{
  "schema": "yaaw.evidence/v2",
  "id": "EVIDENCE-TASK-000-V1",
  "ticket": "TASK-000",
  "ticket_revision": 1,
  "spec_revision": 1,
  "kind": "implementation_verification",
  "repository": {
    "schema": "yaaw.repository-identity/v2",
    "algorithm": "yaaw-worktree-v1",
    "status": "READY",
    "workspace_scope": ".",
    "git_root_relation": "same",
    "head_commit": "COMMIT",
    "dirty": false,
    "worktree_digest": "sha256:DIGEST",
    "components": {
      "status_sha256": "HASH",
      "unstaged_diff_sha256": "HASH",
      "staged_diff_sha256": "HASH",
      "untracked_manifest_sha256": "HASH"
    },
    "changed_paths": [],
    "error": null
  },
  "workflow": "implementation.verify-ticket",
  "commands": [],
  "checks": []
}
